,descripcion,nombre,partido,instagram,facebook,linkedin,tiktok,web,twitter,Circunscripción,Grado de estudio,Profesión,Cuatrienio,Fecha de nacimiento,Edad,Lugar de nacimiento,Género,Whatsapp,Oficina,Teléfono Oficina,Correo Electrónico,YouTube
65,"Bogotana, abogada de la Universidad de la Sabana y magister en Gerencia y Práctica del Desarrollo de la Universidad de los Andes. Fui Concejal de Bogotá (2011-2013); Consultora de Naciones Unidas coordinando la Mesa de Género de la Cooperación Internacional que articula programas de ONU y varias embajadas sobre acceso a la justicia de las mujeres y salud sexual y reproductiva (2009-2011); Alcaldesa local de Chapinero (2005- 2008); Asesora de dos senadores independientes, ambos de la comisión primera sobre asuntos constitucionales: Ingrid Betancourt (2000-2001) y Antonio Navarro Wolff (2001-2005).Trayectoria cívica. Vocera de las veedurías ciudadanas “La séptima se respeta” y “La ciclovía se respeta” activas desde 2010 sobre movilidad, uso de la bicicleta y recreación en la ciudad. Activista por la igualdad de las personas LGBT: Lesbianas, Gays, Bisexuales y Transgeneristas desde 2002. Fui vocera del Referendo contra la Corrupción con el que intentamos una reforma política, recogimos casi dos millones de firmas entre 2000 y 2001 en todo el país. Promuevo los derechos de las mujeres y realicé investigaciones sobre género y calidad de vida de las mujeres desde las ONG Sisma y Humanas en 2004 y 2008. Como estudiante de derecho fui voluntaria en Puerto Nariño-Amazonas con la ONG de jóvenes Opción Colombia. Ahí me desempeñé como Inspectora de Policía y asesora jurídica de la alcaldía municipal y del resguardo indígena en 1998. Participé en la veeduría ciudadana al proceso 8.000 en 1995 y 1996. Promoví el Proceso Pedagógico Voto Inteligente que incentivó el voto libre e informado en las elecciones locales de 1997.Trayectoria Electoral. En 2011 fui elegida concejal de Bogotá por Progresistas, movimiento ciudadano con firmas. Obtuve la tercera votación de la lista de 45 aspirantes que cuenta con una bancada de 8 concejales. Progresistas en 2013 se fusionó en la Alianza Verde. La elección en la alcaldía local de Chapinero no es por voto popular. Me designó el alcalde mayor de la terna que aprobó la Junta administradora local. La terna surgió del examen sobre la ciudad y administración pública que aplicó la Universidad Nacional. De 49 aspirantes en Chapinero, pasamos 9.Políticamente soy de centro-izquierda. Aunque vengo de una familia bipartidista he participado únicamente en procesos “independientes” de los partidos históricos. He intentado construir organización política con ideas de corte progresista. APC: “Hacia una alternativa política colectiva” proceso académico y cívico fue mi escuela fundamental de 1998 a 2001. Ahí conocí a las personas y equipos de trabajo con los que siento más afinidad y con los que después he trabajado, como Antanas Mockus, Antonio Navarro, Enrique Parejo, Sergio Fajardo y Carlos Vicente De Roux. Estoy convencida de la necesidad de más mujeres en la política, ya que podemos incidir en forma distinta en lo público y aún somos pocas. Fui Gerente Nacional de Movilización Ciudadana en la Campaña Mockus Presidente en 2010.Distinciones. He obtenido tres becas para formación política y profesional, dos en Estados Unidos y una en Chile que por fuerza mayor no pude utilizar. Fui galardonada como mejor funcionaria pública en el 2007 por la Mesa de Derechos Humanos de Bogotá. Fui Incluida entre los 30 líderes de 2013 por la Revista Semana (edición 1635), entre los 100 líderes de la sociedad del 2011 por la Revista Gerente (edición 165) y la Revista Cambio me incluyó en los 50 líderes del país en 2007 (edición 750)Estudios. Derecho en la Universidad de La Sabana (94 al 98). Becaria sobre gobierno local y estatal del Departamento de Estado de los Estados Unidos, Maryland (2010) y del Programa de Liderazgo del NDI, Instituto Nacional Demócrata, Washington (2004).Ver: http://angelicalozano.com/angelicalozano10/#sobreangelica",Angélica Lozano Correa,Alianza Verde Centro Esperanza Coalición,,https://www.facebook.com/angelicalozanocorrea,,,,https://twitter.com/AngelicaLozanoC,Circunscripción Nacional en Distrito Capital,Maestría,Abogado/a,2022 - 2026,7 de mayo de 1976,47,Bogotá,Femenino,3125302627,228 Ed. Nuevo Congreso,382 3000 ext: 3440 - 3441 - 3451,angelica.verde110@gmail.com,http://www.youtube.com/bogotaserespeta
66,"Es comunicador social de la Universidad Cooperativa. Fue alcalde de Altamira (Huila) en 1980, concejal de Garzón entre 1980 y 1982, secretario general de la Asmablea del Huila entre 1987 y 1988, diputado entre 1992 y 1994, y secretario privado y de gobierno del Huila de varios gobernadores, el último de los cuales fue el conservador Jaime Bravo Motta. Incluso, fue gobernador encargado en varias ocasiones. Al salir de la gobernación se dedicó a los medios: primero fue director de noticias de la cadena radical huilense Sistema As, y luego gerente y editor general del Diario del Huila entre 2004 y 2006. Luego fue asesor de María del Rosario Guerra en el Ministerio de Comunicaciones, amistad que aún mantiene y que le ayudó a conseguir un buen cupo en la lista. En 2010, cuando trabajaba para la campaña presidencial de Santos en el equipo de comunicaciones, fue contratado por la Radio Televisión Nacional de Colombia, y aparentemente nunca cumplió con su contrato. Desde entonces ha trabajado muy de cerca de Álvaro Uribe. Su ingreso a la lista en ese puesto se ha visto como una victoria de Guerra y un mal resultado para dos grupos políticos huilenses que quería meter una ficha: algunos grupos conservadores y el de Carlos Julio y Cielo González.Fuente: http://lasillavacia.com/historia/la-lista-de-uribe-al-senado-45668",Ernesto Macías Tovar,Centro Democrático,,https://www.facebook.com/Ernesto-Mac%C3%ADas-Tovar-165203490567286/?nr,,,,https://twitter.com/ernestomaciast,Circunscripción Nacional en ...,Universitaria,Comunicador/a social,2018-2022,29 de junio de 1955,68,Altamira,Masculino,,Capitolio 3 Piso,382 3000 ext: 5099,,
67,"La Senadora Maritza Martínez Aristizábal nació en Villavicencio, Meta. Su madre es Gladys Aristizábal, comerciante nacida en Manizales, y su padre Francisco Martínez, piloto comercial, casada con Luis Carlos Torres Rueda, madre de Ana María y María Paula, y abuela de María Paloma.Abogada, Especialista y Magister en Derecho Público la llevó a cabo en la Universidad Externado de Colombia. Inició su carrera profesional en la Rama Judicial como Oficial Mayor del Tribunal Superior del Distrito Judicial de Villavicencio para luego ascender a Magistrada Auxiliar del Consejo de Estado. En el año 2005 se vinculó a la Organización de Estados Iberoamericanos-OEI en calidad de asesora del gobierno nacional en temas ambientales.En el año 2007 ingresó al escenario político al frente del movimiento “Volvamos a Avanzar”, obteniendo el respaldo de más de 170.000 ciudadanos quienes con su firma respaldaron su aspiración a la Gobernación del Departamento del Meta; luego en el año 2010 con una de las mayores votaciones del Partido de la U, obtuvo la única curul en el Senado de la República. En el periodo 2013-2014 se desempeñó como Presidenta de la Comisión Quinta Constitucional encargada los asuntos agropecuarios, ambientales y minero-energéticos. Aspiró nuevamente al Senado para el periodo 2014-2018, siendo reelegida con 73.037 votos, constituyéndose en las votaciones más destacadas en el país y una de las de mayor importancia dentro del partido de la U. Desde su ingreso a la Cámara Alta del Congreso de Colombia, se ha destacado por velar por los intereses sectoriales y regionales a través de la gestión de diversas iniciativas legislativas, como la que mejoró la situación laboral de las madres comunitarias a través de un ingreso otorgado por el Instituto Colombia de Bienestar Familiar, establecer la obligatoriedad de las cuotas de genero a favor de la mujer, en los programas del sector rural, como la adjudicación de baldíos y proyectos productivos , la consolidación de la cultura regional mediante la reivindicación de la memoria del poeta y escritor Eduardo Carranza, la creación de incentivos para los pequeños productores mineros ante prohibición de uso del mercurio en Colombia o el requerimiento de licencia ambiental para efectuar actividades de sísmica exploratoria de hidrocarburos, logro incluir en el estatuto anticorrupción dos artículos para afianzar la transparencia en la contratación estatal.Igualmente se ha destacado por liderar la discusión en temas de interés nacional como la reforma a las regalías, donde se opuso a la reducción de los giros en las regiones productoras de hidrocarburos y la continua exigencia en un precio especial de la gasolina en los municipios productores. Igualmente ha realizado destacados pronunciamientos ante la crisis del sector agropecuario, situación de la mujer rural en Colombia, los precios del etanol en Colombia, la vivienda urbana y rural en el país, funciones ejercidas por la comisión rectora de regalías, situación de la mujer rural en Colombia, la construcción de la doble calzada en la vía Villavicencio-Bogotá, así como de vías y puentes que comuniquen Casanare, Arauca y Vichada, seguimiento a la gestión de la Agencia Nacional de Hidrocarburos-ANH, el desarrollo integral de la Altillanura, la estructura de costos de los biocombustibles, la participación de las ganancias del país en el campo Quifa de Puerto Gaitán y las condiciones de explotación de la mina de ferroníquel en Carromatoso Córdoba, la exploración sísmica y la grave problemática ambiental del Departamento del Casanare.La actividad como parlamentaria de Maritza Martínez la ha llevado a ser reconocida como una de las congresistas de mejor desempeño en las labores legislativas en el parlamento colombiano, y la publicación económica más importante del país, Revista Dinero la ubico como una de las diez mejores congresistas del país. “A juzgar por el tono y la calidad de sus debates, el nombre de esta Senadora Llanera se destaca en el horizonte de la bancada femenina” Revista Dinero.",Maritza Martínez Aristizábal,Partido de la U - Partido de la Unión por la Gente,,https://www.facebook.com/MaritzaSenado,,,,https://twitter.com/Maritza_Senado,Circunscripción Nacional en ...,Maestría,Abogado/a,2018-2022,13 de julio de 1968,54,Villavicencio,Femenino,3125401202,214 - 215 Ed. Nuevo del Congreso,382 3000 ext: 3269 - 3308 - 3366,,http://www.youtube.com/user/MaritzaSenado
68,"Es un político y economista colombiano graduado de la Universidad de Antioquia. Fue miembro de la Asamblea Constituyente de 1991, y candidato a la vicepresidencia de la república en 2006. Además, ha sido gerente de la Constructora de Pereira, Presidente de la Cámara de Comercio de Pereira, Secretario General de la ANDI y Presidente de la Bolsa de Medellín. Entre otras funciones, ha sido consultor de la OEA(2004-2005), Embajador de Colombia ante las Agencias de Naciones Unidas(1992-1994), Senador de la República (1986-1990), Concejal de Medellín (1984-1985),Secretario General del Ministerio de Desarrollo(1977-1978), Alcalde de Pereira (1974-1975), Jefe de Planeamiento del Ministerio de Agricultura(1972-1973. También se ha dedicado a la investigación y consultoría de empresas privada nacionales y entidades internacionales.Tomado de: http://www.ivanmarulanda.com/wp-content/uploads/2018/02/HOJA-DE-VIDA-Y-CARGOS-.doc.pdf",Luis Iván Marulanda Gómez,Alianza Verde,,https://es-la.facebook.com/pg/IvanMarulandaGomez,,,,https://twitter.com/ivanmarulanda,Circunscripción Nacional en ...,Universitaria,Economista,2018-2022,4 de junio de 1946,77,Pereira,Masculino,,636 Ed. Nuevo Congreso,382 3000 ext: 3309 - 3310 - 3311 - 3312,,
69,"Fue concejal uribista en Barranquilla en 23016 y 2017, pero renunció para lanzarse al Senado. Cantante y politólogo, con especialización en Mercadeo de la Universidad de los Andes y Maestría en Administración del Business School de Madrid, España.Tomado de La Silla Vacía https://bit.ly/2LA45aL",Carlos Manuel Meisel Vergara,Centro Democrático,,https://www.facebook.com/carlosmeiselv,,,,https://twitter.com/carlosmeiselv,Circunscripción Nacional en Atlántico,Maestría,Politólogo/a,2022 - 2026,10 de mayo de 1985,38,Barranquilla,Masculino,,414 Ed. Nuevo Congreso,382 3000 ext: 3443 - 3444,,
70,"Fue Diputado por el departamento de Caldas y fundador del primer grupo uribista en 2002.Estudió Negocios en la Pontifica Universidad Javeriana en Bogotá.Fuente: http://bit.ly/2folohi--Mejía es del grupo de Óscar Iván Zuluaga y por Adriana Gutiérrez. En 2003 se quemó en la lista de Zuluaga, liderada por el hoy senador Jaime Alonso Zuluaga, a la Asamblea, pero en 2006 lo reemplazó en la lista y llegó a la Asamblea. En 2007 se quemó tratando de regresar, en medio de las sindicaciones de parapolítica contra Gutiérrez y sin apoyo de Jaime Alonso Zuluaga. Luego trabajó en Bogotá como lobbyista informal de Caldas, en llave con sus aldiaos políticos, y recientemente se ha dedicado a impulsar el Centro Democrático en ese departamento.Fuente: http://lasillavacia.com/historia/la-lista-de-uribe-al-senado-45668",Carlos Felipe Mejía Mejía,Centro Democrático,,https://www.facebook.com/cfmejia,,,,https://twitter.com/CARLOSFMEJIA,Circunscripción Nacional en Caldas,Universitaria,Mercadeo / Negocios Internacionales,2018-2022,21 de octubre de 1961,61,Manizales,Masculino,,648B Ed. Nuevo Congreso,382 3000 ext: 4481,,
71,"Es administrador de empresas de los Estados Unidos.A lo largo de mi vida he creado un importante número de empresas en el sector de la construcción, las telecomunicaciones y las nuevas tecnologías, las que actualmente tienen gran cubrimiento en Colombia.",Juan Samy Merheg Marún,Conservador Colombiano,,https://www.facebook.com/samymsenador,,,,,Circunscripción Nacional en Risaralda,Universitaria,Administrador/a de empresas,2022 - 2026,4 de abril de 1967,56,Pereira,Masculino,3157509903,336 Ed. Nuevo Congreso,382 3000 ext: 3313 - 3314 - 3360,samymerheg@msn.com,
72,,Aida Merlano Rebolledo,Conservador Colombiano,,https://www.facebook.com/aida.merlano.31,,,,,Circunscripción Nacional en Atlántico,Universitaria,Abogado/a,2018-2022,19 de marzo de 1976,47,Barranquilla,Femenino,3012484860,701 Ed. Nuevo Congreso,4325100 ext: 3722 - 3723,,http://www.youtube.com/channel/UCsgUErufHdnwXA6TPNQBYYw
73,,Aurelijus Rutenis Antanas Mockus Sivickas,Alianza Verde,,https://es-la.facebook.com/a.mockus/,,,,,Circunscripción Nacional en ...,Maestría,Matemático/a,2018-2022,25 de septiembre de 1952,70,Bogotá,Masculino,,ST Ed. Nuevo Congreso,382 3000 ext: 3362 - 3363 - 3355 - 3356,,
74,"Abogado de la Universidad San Buenaventura Cali, especialista en Derecho Administrativo de la Universidad Pontificia Bolivariana, especialista en Gestión de Entidades Territoriales de la Universidad Externado de Colombia.Se ha desempeñado como Jefe de la Unidad Jurídica (Gerencia Territorial alcaldía de Cali); Jefe de la Unidad Administrativa (Gerencia de Desarrollo Territorial de Cali); Director Operativo Encargado del Centro de Administración Local Integrado, C.A.L.I. No.6; Secretario de Gobierno del Departamento del Valle del Cauca; Representante a la Cámara periodo 2006 – 2010 y actualmente se encuentra ejerciendo su segundo periodo como Senador de la República, desde la Comisión Primera Constitucional Permanente de la cual fue presidente durante la legislatura comprendida entre los años 2016 y 2017.Durante su recorrido profesional y político se ha destacado como un excelente funcionario, comprometido, transparente, eficiente, destacándose por su interés en el bienestar de los ciudadanos. Es reconocido por sus múltiples cualidades y virtudes y por la legitimidad de su trayectoria al servicio de los colombianos.Tomado de: http://www.partidocambioradical.org/quienes-somos/senadores-representantes/carlos-fernando-motoa-solarte",Carlos Fernando Motoa Solarte,Cambio Radical,,https://www.facebook.com/cmotoa,,,,https://twitter.com/senadormotoa,Circunscripción Nacional en Valle del Cauca,Especialización,Abogado/a,2022 - 2026,24 de octubre de 1975,47,Palmira,Masculino,3006197071,223 Ed. Nuevo del Congreso,382 3000 ext: 3717 - 3718 - 3719,cmotoa@hotmail.com,https://www.youtube.com/channel/UCWDCHTwTulU1ayOBui_D1cw
75,"Estudié Administración de Empresas en la Universidad Autónoma del Caribe, adelanté estudios de idiomas en Georgia Tech y me especialicé en Gerencia, Gobierno y Asuntos Públicos en Columbia University en New York y la Universidad Externado de Colombia.Fui elegido, por primera vez, como Senador de la República, en el año de 2006En mi experiencia previa a la llegada al Congreso de la República, se destacan la gestión realizada en la Gerencia General de la empresa T-Shirt Ltda. y la Gerencia Comercial de Valencia e Iragorri Corredores De Seguros. En el año 1999, empecé mi labor como Cónsul de Colombia en Nueva York - EEUU, misión que llevé a cabo hasta el año 2005.Fui honrado con la Presidencia de la Comisión V del Senado de la República, función que desempeñé, durante un año..http://www.josedavidname.com/perfil-de-jose-name",José David Name Cardozo,Partido de la U - Partido de la Unión por la Gente,,http://www.facebook.com/josedavidnamecardozo,http://co.linkedin.com/in/josedavidname,,,https://twitter.com/JoseDavidName,Circunscripción Nacional en Atlántico,Especialización,Administrador/a de empresas,2022 - 2026,18 de noviembre de 1968,54,Barranquilla,Masculino,3114291856,332 Ed. Nuevo del Congreso,382 3000 ext: 3384,info@josedavidname.com,http://www.youtube.com/user/prensajosedavidname
76,"Abogado de la Pontificia Universidad Javeriana.Mientras estudiaba derecho, y dadas las circunstancias políticas de la época, cuando aún era muy joven se inició en el ejercicio de la política. En compañía de varios estudiantes de dicha facultad, y con la aquiescencia y apoyo del entonces Decano R. Padre Gabriel Giraldo creó un movimiento llamado, Juventudes de Acción Social (J.A.S.), donde se ocupó de hacer un análisis de las corrientes ideológicas predominantes de la época.Fue electo Diputado a la Asamblea de Cundinamarca. Posteriormente fue elegido Representante a la Cámara por Bogotá en dos oportunidades. Fue un atento y activo interviniente de los cambios que realizó la Constitución Política de 1991.Hacia mediados de los años 90’s fue Concejal de Bogotá, desde donde lideró cambios en materia de movilidad y desarrollo urbano. Desde la dirección del Movimiento Viraje Social, ha apoyado con exito la candidatura de otros miembros de su organización hasta la actualidad.http://quiensoy100.blogspot.com/Adhirió a la Campaña por la Transparencia que creó una sección en la página principal del Senado en la que los ciudadanos podrán consultar el nombre del senador, el partido de elección, la votación obtenida, su Declaración juramentada de bienes, el Registro de conflicto de intereses y los nombres de los miembros de Unidad de Trabajo Legislativo (UTL) del senador.Representante suplente ante el Parlamento Andino.Mayor información: www.senado.gov.co",Iván Leonidas Name Vásquez,Alianza Verde Centro Esperanza Coalición,,https://www.facebook.com/SenadorIvanName/?ref=profile_intro_card,,,,https://twitter.com/IvanNameVasquez,Circunscripción Nacional en Atlántico,Universitaria Incompleta,Abogado/a,2022 - 2026,18 de junio de 1957,66,Barranquilla,Masculino,318 712 0247,201 Ed. Nuevo del Congreso,382 3000 ext: 3205,ivan.name.vasquez@senado.gov.co,http://www.youtube.com/user/senadorivannamev
77,"Nació en Mercaderes (Cauca, Colombia)Abogado de la Universidad del CaucaEstudios realizados:- Doctor en Derecho, Ciencias Políticas y Sociales 1979. Universidad del Cauca.- Postgrado en Gerencia, Gobierno y Asuntos Públicos. Universidad Externado de Colombia-Universidad Columbia (N.Y).- Maestría en Economía. Universidad Javeriana. Bogotá- Administración de la Calidad Total del Cauca. Universidad del Cauca- Instituto Tecnológico de Monterrey- Gerencia de Proyectos. Universidad de los Andes.Cargos ocupados:- Gobernador del Cauca (2012-2015).- Magistrado Consejo Superior de la Judicatura Sala Jurisdiccional Disciplinaria (2000-2008).- Director Capacitación Contraloría General de República.- Gobernador del Cauca (1992-1995).- Viceministro de Justicia (1986-1990).- Secretario de Educación Departamental del Cauca.- Gerente Cajanal del Cauca.- Director Capacitación Contraloría General de la República.- Consultor Legal Corporación Andina de Fomento –CAF.- Abogado litigante.Tomado de: https://www.temistoclesortega.com/acerca-de",Temístocles Ortega Narváez,Cambio Radical,,https://www.facebook.com/OrtegaNarvaez/,,,,https://twitter.com/temisortega?lang=es,Circunscripción Nacional en ...,Maestría,Abogado/a,2018-2022,21 de octubre de 1954,68,Mercaderes,Masculino,,428B Ed. Nuevo Congreso,382 3000 ext: 3449 - 3471 - 4329,temistocles.ortega@senado.gov.co,https://www.youtube.com/channel/UCHinmwxYb0fpy5C5BGjHWAQ
78,"Tuve la fortuna de nacer y crecer en Paz de Río- Boyacá cursé mis estudios de secundarios en la Institución Educativa Técnica Minera, soy Administradora de Empresas de la Universidad de la Salle y Especialista en Gobierno y Gestión pública, de la Pontificia Universidad Javeriana, con diplomado en Gerencia de la Gestión Legislativa de la ESAP.Asesora en la Unidad de Trabajo Legislativa del Congreso de la República del 2006 – 2007, Gerente del Sistema Único de Acreditación y Certificación de COLDEPORTES Nacional en el 2007 – 2008, Candidata a la Cámara de Representantes en el 2010, pre candidata a la Gobernación de Boyacá, Secretaria de Participación y Democracia de la Gobernación de Boyacá en el 2012, Representante a la Cámara por Boyacá periodo 2014- 2018.Vicepresidenta de la Cámara de Representantes, integrante de la Comisión Tercera de impuestos y presupuesto, Copresidenta de la Fundación Cuacos Conservacionista colombiano ICCF, Ponente del Presupuesto General de la Nación.Es mi trabajo legislativo en estos cuatro años que los boyacenses depositaron ese importante voto de confianza, resaltó algunos de los mayores logros de mi trabajo legislativo siendo muchos más pero me enorgullece los aportes importantes y significativos por mi departamento de Boyacá.Tomado de: http://www.sandraortiz.co/biografia/",Sandra Liliana Ortiz Nova,Alianza Verde,,https://www.facebook.com/sandraortizsenadora/,,,,https://twitter.com/SandraOrtizN,Circunscripción Nacional en ...,Especialización,Administrador/a de empresas,2018-2022,6 de marzo de 1977,46,Paz del Río,Femenino,,327 Ed. Nuevo Congreso,382 3000 ext: 3707 - 3708 - 3709,sandra.ortiz@senado.gov.co,http://www.youtube.com/user/SuperPUBLIS
79,"Abogado, especialista en Derecho Penal, Criminología y Ciencias Criminalísticas.Amplia trayectoria en el área del derecho penal, derechos humanos y funciones públicas en la Fiscalía.Tomado de: página Colombia Justa Libres http://bit.ly/2H5MDbH",Eduardo Emilio Pacheco Cuello,Colombia Justa Libres (Antes Movimiento Libres),https://www.instagram.com/eduardopachecoc/,https://www.facebook.com/eduardo.pacheco.39142,,,,https://twitter.com/senadoreduardop,Circunscripción Nacional en ...,Especialización,Abogado/a,2018-2022,24 de octubre de 1953,69,Medellín,Masculino,,311 Ed. Nuevo Congreso,382 3000 ext: 3092-3093-3387,eduardo.pacheco@senado.gov.co,
80,"Profesor de Filosofía,Teología y Ciencias Políticas, especialista en dd.hh, demócrata defensor de la libertad.Especialista en Derechos Humanos Estudios político -económicos.Tomado de: página Colombia Justa Libres http://bit.ly/2H5MDbH",Edgar Enrique Palacio Mizrahi,Colombia Justa Libres (Antes Movimiento Libres),https://www.instagram.com/epalaciomizrahi/,https://www.facebook.com/edgarpalaciosenador,,,,https://twitter.com/epalaciosenado,Circunscripción Nacional en ...,Especialización,Filosofo/a,2018-2022,24 de julio de 1970,52,Barranquilla,Masculino,,338B Ed. Nuevo Congreso,382 3000 ext: 4349,edgar.palacio@senado.gov.co,
81,"Líder indígena del pueblo de Los Pastos, además fue gobernador del municipio de Carlosama, Nariño y alcalde del mismo.Tomado de: http://www.bitervopalchucan.com/Biografia/",Manuel Bitervo Palchucan Chingal,AICO - Autoridades Indígenas de Colombia,,https://www.facebook.com/bitervo.palchucan,,,,https://twitter.com/MPalchucan,Circunscripción Especial por Comunidades Indígenas en Comunidades Indígenas,Universitaria,Administrador/a de empresas,2018-2022,27 de septiembre de 1965,57,Guachucal,Masculino,318 5413250,524 Ed. Nuevo Congreso,382 3000 ext: 3596,manuel.palchucan@senado.gov.co,
